{
  "schema_version": "1.0",
  "quiz_id": "quiz2",
  "title": "Quiz 2: Dummy Variables & the t-Test",
  "module": "Dummy Variables & the *t*-Test",
  "available_after": "Week 3",
  "mastery": {
    "full_min": 80,
    "partial_min": 60
  },
  "settings": {
    "time_limit_min": 60,
    "attempts": "unlimited",
    "score_recorded": "highest",
    "show_answers": "immediately"
  },
  "items": [
    {
      "id": "q2-01",
      "type": "matching",
      "number": 1,
      "topic": "Mapping the dummy coefficient table",
      "points": 2,
      "difficulty": "conceptual",
      "stem": "Using the US PISA 2000 sample ($N = 1{,}020$), reading score (`wleread`) is regressed on `female`, a dummy coded **0 = male (reference)** and **1 = female**. The fitted equation is\n\n$$\\widehat{\\text{wleread}} = 507.86 + 27.70 \\times \\text{female}.$$\n\nMatch each quantity from the model (left) to the group statistic it equals (right). Each statistic is used exactly once.",
      "prompts": [
        {
          "id": "p1",
          "text": "The intercept, $507.86$",
          "match": "z",
          "rationale": "with a single 0/1 dummy, the intercept is the predicted score when `female = 0`. Because `female = 0` is the male (reference) group, the intercept $507.86$ *is* the male mean."
        },
        {
          "id": "p2",
          "text": "The `female` coefficient, $27.70$",
          "match": "x",
          "rationale": "the slope is the predicted change in the outcome as `female` goes from 0 to 1 — the female mean minus the male mean, $535.56 - 507.86 = 27.70$ points."
        },
        {
          "id": "p3",
          "text": "Intercept + coefficient, $507.86 + 27.70$",
          "match": "y",
          "rationale": "evaluating the equation at `female = 1` gives the female mean, $507.86 + 27.70 = 535.56$ points."
        }
      ],
      "responses": [
        {
          "id": "x",
          "text": "The female − male mean difference, $27.70$ points"
        },
        {
          "id": "y",
          "text": "The female mean, $535.56$ points"
        },
        {
          "id": "z",
          "text": "The male (reference) mean, $507.86$ points"
        }
      ],
      "why_correct": "reading the intercept as the *grand* mean ignores that it is the prediction at `female = 0` (the reference-group mean, not the average over all 1,020 students); reading the coefficient $27.70$ as a group *mean* confuses a difference between means with a level.",
      "source": {
        "chapter": 1,
        "title": "Simple Linear Regression",
        "section": "Regression with a Dummy Variable",
        "href": "../../notes/chapters/01-simple-linear-regression.html#regression-with-a-dummy-variable"
      }
    },
    {
      "id": "q2-02",
      "type": "multiple_choice",
      "number": 2,
      "topic": "Interpreting the dummy slope",
      "points": 1,
      "difficulty": "applied",
      "stem": "In the US PISA regression $\\widehat{\\text{wleread}} = 507.86 + 27.70 \\times \\text{female}$ (`female` coded 0 = male, 1 = female), which statement best interprets the **coefficient on `female` (27.70)**?",
      "options": [
        {
          "id": "a",
          "text": "The mean reading score for female US students is 27.70.",
          "correct": false,
          "rationale": "this confuses the *difference in means* with a *group mean*. The female mean is $507.86 + 27.70 = 535.56$, not 27.70; the coefficient is a gap, not a level."
        },
        {
          "id": "b",
          "text": "Female US students scored about 27.70% higher in reading than male US students, on average.",
          "correct": false,
          "rationale": "the coefficient is in raw reading **points**, not percent. A 27.70-point gap on a score near 508 is about 5.5%, not 27.70%."
        },
        {
          "id": "c",
          "text": "Female US students scored about 27.70 reading points above male US students, on average.",
          "correct": true
        },
        {
          "id": "d",
          "text": "Being female caused a student's reading score to rise by about 27.70 reading points, on average.",
          "correct": false,
          "rationale": "PISA is observational, so the coefficient describes an **association**, not a causal effect; \"caused\" is unjustified without a design that rules out confounders."
        }
      ],
      "why_correct": "for a 0/1 dummy, the slope is the predicted difference in the outcome between the coded group and the reference group. It names the variable (reading score), the direction (higher for females), the magnitude (27.70), and the units (reading points): females scored about 27.70 points higher than males, on average.",
      "source": {
        "chapter": 1,
        "title": "Simple Linear Regression",
        "section": "Regression with a Dummy Variable",
        "href": "../../notes/chapters/01-simple-linear-regression.html#regression-with-a-dummy-variable"
      }
    },
    {
      "id": "q2-03",
      "type": "numeric",
      "number": 3,
      "topic": "Recovering the female mean",
      "points": 2,
      "difficulty": "applied",
      "stem": "The US PISA regression of reading score on `female` (0 = male, 1 = female) is\n\n$$\\widehat{\\text{wleread}} = 507.86 + 27.70 \\times \\text{female}.$$\n\nThe intercept $507.86$ is the mean reading score for males. Using the fitted equation, compute the **predicted mean reading score for female students** (`female = 1`). Enter a number (round to two decimals).\n\nFemale mean = ________",
      "answer": 535.56,
      "accept_range": {
        "min": 535,
        "max": 536.1
      },
      "tolerance": 0.5,
      "why_correct": "under reference-group coding, the comparison group's mean is the intercept plus that group's dummy coefficient. Setting `female = 1`: $\\hat{y} = 507.86 + 27.70(1) = 535.56$ reading points.\n\n**Tolerance:** the window absorbs sensible rounding of the reported coefficients without admitting a wrong method.\n**Common errors to avoid:** answering `27.70` (reporting the *coefficient* — a difference — as if it were the mean), `507.86` (returning the male/reference mean, i.e., forgetting to add the coefficient), or `480.16` (subtracting, $507.86 - 27.70$, instead of adding) — all fall outside the window.",
      "source": {
        "chapter": 1,
        "title": "Simple Linear Regression",
        "section": "Regression with a Dummy Variable",
        "href": "../../notes/chapters/01-simple-linear-regression.html#regression-with-a-dummy-variable"
      }
    },
    {
      "id": "q2-04",
      "type": "multiple_choice",
      "number": 4,
      "topic": "What the coefficient standard error measures",
      "points": 1,
      "difficulty": "conceptual",
      "stem": "In the US PISA regression, the coefficient on `female` is $27.70$ with a **standard error of 5.96**. What does this standard error represent?",
      "options": [
        {
          "id": "a",
          "text": "A 95% confidence interval for the difference between the two mean reading scores.",
          "correct": false,
          "rationale": "a standard error is a single number, not an interval. A confidence interval is *built from* the SE (roughly estimate $\\pm 1.96 \\times \\text{SE}$), but the SE itself is not the interval."
        },
        {
          "id": "b",
          "text": "The sample-to-sample variability of the estimated 27.70-point difference under repeated sampling.",
          "correct": true
        },
        {
          "id": "c",
          "text": "The spread of the individual reading scores around their own mean in the sample.",
          "correct": false,
          "rationale": "the spread of the raw scores around their mean is a standard deviation (the within-group spread is the Root MSE, $94.633$); $5.96$ is far smaller because it describes the precision of an *estimate*, not the variability of individual students."
        },
        {
          "id": "d",
          "text": "Evidence that the estimated difference is large, since a small standard error must imply a big effect.",
          "correct": false,
          "rationale": "a small SE signals **precision**, not **magnitude**. How well we pin down the estimate and how big the difference is are distinct; a small SE does not by itself mean a large effect."
        }
      ],
      "why_correct": "a coefficient's standard error is the standard deviation of that estimate over hypothetical repeated samples. If we redrew samples of 1,020 US students and refit the model, the estimated **27.70-point difference** would vary; 5.96 summarizes that typical sample-to-sample variation — the precision of the estimated mean difference.",
      "source": {
        "chapter": 1,
        "title": "Simple Linear Regression",
        "section": "The $t$-test for the Slope",
        "href": "../../notes/chapters/01-simple-linear-regression.html#the-t-test-for-the-slope"
      }
    },
    {
      "id": "q2-05",
      "type": "true_false",
      "number": 5,
      "topic": "The dummy \"regression line\" has only two fitted values",
      "points": 1,
      "difficulty": "conceptual",
      "stem": "**True or False:** In the regression $\\widehat{\\text{wleread}} = 507.86 + 27.70 \\times \\text{female}$, where `female` takes only the values 0 and 1, the fitted \"regression line\" produces just **two** fitted values — $507.86$ for males and $535.56$ for females — so it is really the two group means joined by a line segment, not a continuous trend.",
      "options": [
        {
          "id": "a",
          "text": "True",
          "correct": true
        },
        {
          "id": "b",
          "text": "False",
          "correct": false,